COMPANYNAME,article,article_link,close,date,prevclose,stockname,time,title,website
BANK OF BARODA,kotak has come out with its fourth quarter januarymarch 19 earnings estimates for the banksdiversified financials sector the brokerage house expects bank of baroda to report net profit at rs 14559 crore up 2089 quarteronquarter net interest income nii is expected to increase by 232 percent yoy up 39 percent qoq to rs 49294 crore according to kotak pre provision profit ppp is likely to rise by 31 yoy down 13 percent qoq to rs 34913 crore disclaimer the views and investment tips expressed by investment experts on moneycontrolcom are their own and not that of the website or its management moneycontrolcom advises users to check with certified experts before taking any investment decisions,https://www.moneycontrol.com/news/business/earnings/bank-of-baroda-q4-net-profit-may-increase-209-qoq-to-rs-1455-9-cr-kotak-3782001.html,132.05,09-04-2019,130.0,BANKBARODA,10:14,"Bank of Baroda Q4 Net Profit may increase 209% QoQ to Rs 1,455.9 cr: Kotak",moneycontrol
BANK OF BARODA,sensex tanked over 500 points intraday extending its losses even after the reserve bank of india rbi decided to cut the repo rate by 25 bps the benchmark was dragged by bank and financial services stocks that traded lower a downward revision of fy20 gdp growth forecast and no major measure to address liquidity conditions for nbfcs dented sentiment suggest experts the unanimous decision by the monetary policy committee mpc of rbi to cut repo rate by 25 bps and change its stance on liquidity from neutral to accommodative while lowering both the gdp growth forecast and inflation forecast for q4fy20 is an unambiguous admission that it has failed to anticipate the sharp deceleration in indias aggregate demand and remains firmly behind the curve in providing succour to the beleaguered economy ajay bodke ceo pms at prabhudas lilladher told moneycontrol no specific measure has been announced that would provide immediate relief to the muchtroubled nbfc sector the market is facing a crisis of confidence with respect to the precariously perched nbfc including hfcs and fixedincome mutual fund sectors he said looking at the market pattern it was indeed a perfect scenario of a buyonrumoursandsellonnews scenario that panned out on june 6 ratesensitive stocks that were hitting record highs in the runup to the mpc meet witnessed a big selloff in intraday trade the nifty bank cracked more than 700 points breaking below 31000 largely weighed down by bank of baroda  indusind bank  idfc first  yes bank  pnb  federal bank and sbi  although a majority of market participants had called for beyond standard cut of 25 bps the current rate cut came in line with the market expectation dinesh rohira ceo and founder at 5nancecom told moneycontrol naveen kulkarni head of research reliance securities told moneycontrol that while the rate cut of 25 basis points was in line with our expectation concerns over growth and challenges regarding liquidity continue to linger the market is not necessarily cheering the rate cut as it had already factored the decision and something more was expected he said rbis decision to cut rates and change in stance to accommodative from neutral earlier signifies a dovish outlook from the central bank but the cut is perhaps not big enough to put asias third largest economy in a recovery mode a 25 bps rate cut falls short of what is required with a delayed and expected insufficient monsoon this cut is a mild inflation tamer but not the big growth driving rate cut that the economy needs ranjan chakravarty product strategy mse told moneycontrol  rbi also lowered the gdp growth rate forecast for fy20 to 7 percent from 72 percent that indicates the likelihood of economy facing headwinds led by a slowdown in consumption and private investment said experts,https://www.moneycontrol.com/news/business/markets/rbi-rate-cut-market-sensex-tanks-factors-4069291.html,124.35,06-06-2019,132.6,BANKBARODA,18:50,"A 25 bps rate cut fails to cheer the market, Sensex tanks 500 pts; here's why",moneycontrol
BANK OF BARODA,icici directs research report on bank of baroda bank of baroda bob reported robust operating earnings led by strong nii of 266 yoy  healthy other income at 16 yoy however higher provision at rs 5550 crore dented earnings with loss at rs 991 crore credit growth came in at 10 yoy at rs 468819 crore led by 13 yoy growth in domestic advances further driven by retail 24 yoy corporate 16 yoy  agriculture 14 yoy outlook focus on building operational granularity and improvement in efficiency will enable the bank to pedal healthy growth balance sheet growth with focus on retail bodes well for risk adjusted returns and capital consumption recognition of majority of stressed assets and anticipated higher recovery to bolster earnings ahead the management has ruled out any substantial impact due to merger synergy from merger is seen to accrue at gradual pace rolling on to fy21e we upgrade our target price to rs 170 earlier rs 140 valuing the stock at 12x fy21e abv postmerger we maintain buy for all recommendations report click here disclaimer the views and investment tips expressed by investment expertsbroking housesrating agencies on moneycontrolcom are their own and not that of the website or its management moneycontrolcom advises users to check with certified experts before taking any investment decisions,https://www.moneycontrol.com/news/business/stocks/buy-bank-of-baroda-target-of-rs-170-icici-direct-4034031.html,136.35,29-05-2019,139.8,BANKBARODA,22:00,Buy Bank of Baroda; target of Rs 170: ICICI Direct,moneycontrol
BANK OF BARODA,public sector lender bank of baroda narrowed its fourth quarter fy19 net loss to rs 9914 crore from rs 31023 crore in the same period last year on elevated provisions the loss was despite higher nii other income and operating profit net interest income grew 266 percent yearonyear yoy to rs 5067 crore in the januarymarch quarter provisions remained elevated in q4 at rs 53993 crore against rs 27942 crore in the previous quarter and rs 6672 crore in the corresponding period last year however asset quality improved with gross nonperforming assets gnpa as a percentage of gross advances rs 482328 crore falling to 961 percent in q4 against 1101 percent rs 531843 crore in december quarter net npa also came in lower at 333 percent rs 156095 crore during the quarter against 426 percent rs 191305 crore in the previous period fresh slippages for the quarter stood at rs 3192 crore,https://www.moneycontrol.com/news/business/earnings/bank-of-baroda-narrows-q4-loss-to-rs-991-4-cr-asset-quality-improves-4006661.html,126.15,22-05-2019,125.8,BANKBARODA,18:24,"Bank of Baroda narrows Q4 loss to Rs 991.4 cr, asset quality improves",moneycontrol
BANK OF BARODA,bank of baroda shares gained 3 percent intraday on june 28 despite global brokerage credit suisse maintaining its bearish call on the stock we maintain underperform call on the stock with a target price at rs 115 per share implying 5 percent potential downside from current levels the research firm said the brokerage further said growth for the merged entity has continued to weaken and it expects growth to remain tepid vijaya bank and dena bank amalgamated with bank of baroda we f april 1 2019 the board of directors on june 27 approved opening balance sheet of the amalgamated bank the bank said credit suisse said postmerger balance sheet reveals rs 6000 crore hit taken to harmonise acting policies cet1 is now at 86 percent versus 104 percent reported by bank in q4 it implies acquisition cost of 11x fy19 pb for dena  08x for vijaya bank the brokerage further said coverage to ilfs exposure remains low at 25 percent but exposure to adag dhfl  nbfcs will keep slippages  credit costs elevated we expect return on equity to remain in single digits even in fy21,https://www.moneycontrol.com/news/business/markets/bank-of-baroda-climbs-3-despite-credit-suisse-retaining-bearish-call-4149621.html,121.6,28-06-2019,121.4,BANKBARODA,15:19,Bank of Baroda climbs 3% despite Credit Suisse retaining bearish call,moneycontrol
BANK OF BARODA,the market snapped three weeks losing streak on the back of buying seen in the banking sector during last week nifty traded in a tight range of 1190011640 forming a bullish candlestick pattern current weekly candlestick pattern formation suggests strong uptrend to unfold if nifty closes above the previous weeks high of 11910 nifty is trading near its major simple moving average 50dma which is rising and placed around 11700 at the same time rsi indicator on the monthly timeframe is trading around 65 that signifies positive momentum also rsi on weekly time frame took a reversal from 50 forming pullback buy pattern it is currently trading around 60 indicating a high probability of original trend to rebegin major trend line support on lower time frame and principle of polarity is near 1157511600 our buy on dip strategy is valid till nifty stays above the strong demand zone at 11575 nifty future rollover data till june expiry is 80 percent which is higher than last months rollover data of 71 percent as well as greater than 3 months average rollover of 77 percent indicating strong trading interest ahead of the budget bank nifty after opening lower bank nifty took support from strong support zone of previous swing low and 382 percent fibonacci retracement levels placed around 30500 forming long body bullish candlestick pattern it has also given confirmation of trend reversal by closing above last weeks high 30824 as long as low of the previous week 30451 is intact it will trade higher towards its life high placed around 31783 moreover the trading range for the banking index will be 3080031700 for the coming week here are five short term picks bank of baroda  rating buy around rs 120  target rs 145 stop loss rs 104  upside 21 percent the stock has corrected from the peak of rs 144 and has shown signs of bottoming out around rs 115 formation of rounding bottom on the daily chart is showing a positive move on the upside long bullish candle near the point of polarity on the weekly chart is showing the possibility of a bounce back further on the upside with decent volume participation witnessed we recommend a buy in this scrip around rs 120 for an upside target of rs 145 with a stop loss of rs 104 punjab national bank  rating buy around rs 78  target rs 89  stop loss rs 7360  upside 14 percent prices of pnb has seen a rebound after hitting a low of rs 73 where its key support is seen the emergence of morning star on the weekly chart is giving the possibility of a pullback on the higher side in the coming sessions rsi has started curling up after testing its oversold zone and daily macd has given bullish crossover in positive territory buy around rs 78 with a stop loss of rs 736 and target at rs 89 canara bank  rating buy around rs 280  target rs 310  stop loss rs 259  upside 11 percent recently the stock gave trend line break out on upside that suggests trend reversal on the daily chart from last few days it has been trading above its 20 50 100 and 200dmas that indicates strength formation of the green candle while giving trend line breakout indicates stock can surge further buy canara bank around rs 280 with a stop loss of rs 259 for the target of rs 310 dredging corporation of india  rating buy around rs 425  target rs 470  stop loss rs 398  upside 11 percent the stock price gave pole and flag breakout out on upside that suggests trend reversal on the daily chart from last few days it has been trading above its 50100 and 200dmas along with bullish crossover that indicates strength formation of bullish belt hold while giving breakout indicates stock can surge further bharat petroleum corporation  rating buy around rs 390  target rs 420 stop loss rs 369  upside 8 percent the stock has given a decent correction from the peak of rs 414 to rs 373 and has taken support at its lower levels now it has regained strength indicating a positive bias sustainability above the rising trend line is suggesting upside strength the emergence of bullish engulfing on the weekly chart is further showing strength we anticipate the stock to rise further in the coming days with strength in volume one can take a long position around rs 390 for the target of rs 420 with a stop loss of rs 369 on a closing basis the author is head of technical  derivative research at narnolia financial advisors,https://www.moneycontrol.com/news/business/stocks/buy-on-dips-nifty-stock-recommendations-4153111.html,121.25,01-07-2019,121.6,BANKBARODA,10:30,"'Buy on dips till Nifty stays above 11,575; bet on these 5 stocks for 8-21% upside'",moneycontrol
BANK OF BARODA,bank of baroda bob on monday became the second largest stateowned lender after merging dena bank and vijaya bank into itself as part of the first threeway amalgamation the consolidated entity started its operation with a business mix of over rs 15 lakh crore of balance sheet with deposits and advances of rs 875 lakh crore and rs 625 lakh crore respectively bob now has over 9500 branches 13400 atms 85000 employees to serve 12 crore customers meanwhile bob completed share allotment to shareholders dena bank and vijaya bank as per the scheme of amalgamation shareholders of vijaya bank got 402 equity shares of bob for every 1000 shares held in the case of dena bank its shareholders received 110 shares of bob for every 1000 shares the bank on monday issued and allotted equity shares at approved share exchange ratio pursuant to amalgamation of vijaya bank and dena bank with bank of baroda scheme 2019 bob said in a regulatory filing postamalgamation the bank will have a 22 per cent market share in gujarat and 810 per cent market share in maharashtra karnataka rajasthan and uttar pradesh the bank has said all customers of dena bank which is under prompt corrective action pca framework of the rbi will have renewed access to credit facilities immediately the government in september last year announced the firstever threeway consolidation of banks in india with a combined business of rs 1482 lakh crore making it the thirdlargest bank after state bank of india sbi and hdfc bank the announcement of the threeway merger was among several reforms initiatives undertaken by financial services secretary rajiv kumar to make public sector banks psbs healthy robust and globally competitive as part of the reform process the government had also announced transfer of majority 51 per cent stake to life insurance corporation lic in idbi bank in august last year to transform the mumbaibased lender besides the department of financial services made a record capital infusion of rs 106 lakh crore in the psbs in the fiscal 201819 as a result five public sector banks including bank of india corporation bank and allahabad bank were out of the prompt corrective action framework of the rbi earlier this year nonperforming assets npas showed a negative trend in 201819 and reduced by rs 23860 crore between aprilseptember 2018,https://www.moneycontrol.com/news/business/bank-of-baroda-becomes-second-largest-psu-bank-after-sbi-3738891.html,132.7,01-04-2019,128.65,BANKBARODA,12:33,Bank of Baroda becomes second largest PSU bank after SBI,moneycontrol
BANK OF BARODA,kotak has come out with its first quarter apriljune 19 earnings estimates for the banksdiversified financials sector the brokerage house expects bank of baroda to report net profit at rs 9507 crore up 80 yearonyear net interest income nii is expected to increase by 55 percent yoy up 34 percent qoq to rs 67703 crore according to kotak pre provision profit ppp is likely to rise by 60 yoy up 24 percent qoq to rs 47982 crore disclaimer the views and investment tips expressed by investment experts on moneycontrolcom are their own and not that of the website or its management moneycontrolcom advises users to check with certified experts before taking any investment decisions,https://www.moneycontrol.com/news/business/earnings/bank-of-baroda-q1-net-profit-seen-up-80-yoy-to-rs-950-7-cr-kotak-4194201.html,126.0,11-07-2019,124.25,BANKBARODA,16:50,Bank of Baroda Q1 Net Profit seen up 80% YoY to Rs. 950.7 cr: Kotak,moneycontrol
BANK OF BARODA,we believe bank of baroda has transformed itself into a new age bank under the guidance and leadership of its md  ceo ps jayakumar and whole rejuvenated team of the bank bank of baroda accomplished several standards which were set earlier when current md and ceo had taken over the charge of its banking operations the banks transformation journey involving initiatives across business units and support functions like it hr operations  services continue to reap dividends domestic yoy credit growth remained in double digits for eight quarters led by 2418 percent increase in home and auto loans at 2215 percent and 4943 percent net interest income nil increased to rs 4863 crore adjusting for it refund of rs 204 crore in march 2019 nil increased by 2573 percent on a yoy basis domestic core fee income increased by 1041 percent on yoy basis to rs 995 crore consolidated and standalone operating profit stood at rs 15519 crore and rs 13487 crore respectively for fy 2019 an increase of 1234 percent and 1443 percent respectively treasury trading gains were lower at rs 989 crore from rs 1878 crore in fy 2018 standalone operating profit for q4 fy 19 stood at rs 3861 crore registering an increase of 4488 percent net interest margin nim improved to 29 percent in q4 fy 19 from 269 percent last quarter for the year nim increased to 272 percent from 243 percent in the previous year domestic nim increased to 298 percent in q4 fy 19 adj for it refund from 28 percent last quarter the government of india on march 28 2019 infused an amount of rs 5042 crore towards preferential allotment of equity shares pending allotment of the shares the amount has been disclosed under share application money pending allotment as on march 31 2019 the bank has considered such amount received from government of india as a part of common equity tieri cet 1 capital as on march 31 2019 capital adequacy ratio of the bank stood at 1342 percent and cet 1 at 1038 percent against 1167 percent and 865 percent in december 312018 consolidated cet1 and capital adequacy ratios improved in march 2019 at 116 percent 974 percent in december 2018 domestic casa deposits registered a growth of 836 percent on yoy basis casa deposits to total domestic deposits at 4023 percent against 4118 percent as on march 31 2018 domestic deposits stood at rs 517966 crore as on march 312019 up 1191 percent from rs 466974 crore as on march 31 2018 domestic advances grew by 1417 percent to rs 370185 crore as on march 31 2019 from rs 324239 crore as on march 312018 the increase was led by retail loans which grew by 2418 percent contribution of banks international business at the end of march 31 2019 was 1981 percent compared with 1987 percent as of december 31 2018 due to effect of rationalisation of overseas operations setting in cost to income ratio was very impressive at 4514 percent in q4fy19 for fy19 cost to income stood at 4556 percent which is one of the best amongst the psu banks gross npa ratio improvement is best in 12 quarters gross npa reduced to 961 percent as on march 31 2019 against 1101 percent last quarter net npa fell to 333 percent from 426 percent last quarter absolute amount of net npa also declined by rs 3521 crore to rs 15609 crore lowest in eight quarters fresh slippage during q4fy19 stood at rs 2662 crore out of which rs 530 crore was from ilfs with regards to much talked accounts the bank has zero exposure to jet airways dhfl account till date is doing well and the bank does not expect any surprises according to mr jaykumar even the exposure to religare is also taken care of the liquidity crisis in nbfc sector may affect bob and it may be reflected in coming quarters but believe the bank is strongly placed to tackle such risks exposure in accounts under ncl t 1 list was rs 3908 crore and ncl t 2 list was rs 3831 crore as on march 312019 provision coverage under ncl t 1 and ncl t 2 list was 9563 percent and 8411 percent respectively again one of the highest auca stood at rs 18000 crore of which the bank expects a recovery of rs 600800 crore per annum the bank frontended npl provisions of rs 5550 crore which includes provisions of rs 1000 crore owing to accounting standardsentries due to delay in resolution of certain key accounts in ibc provisions of rs 1875 crore or thereabouts for reliance communications essel group and videocon fraud related one time provision of about rs 250 crore the bank has considered exposure to six borrowers in infrastructure financial services group as non performing and made provision of rs 400 70 crore for the year ended march 31 2019 which is 237 percent of the outstanding amounts pcr including total written off accounts two increased to 7868 percent and pcr excluding two increased to 6764 percent as on march 31 2019 from 7347 percent and 6403 percent respectively as on december 312018 bank of baroda recorded loss on a standalone basis of rs 991 crore for q4 fy 19 due to acceleration in provisions for the whole year standalone and consolidated profit stood at rs 433 crore and rs 1100 crore respectively we are not worried about bank reporting loss since as a precautionary measure the bank has done front end provisioning to avoid any future stress after the merger with vijaya bank and dena bank bob is the second largest public sector lender after state bank of india and has now over 9500 branches 13400 atms and 85000 employees to serve 12 crore customers the consolidated entity has now business mix of over rs 16 lakh crore on the balance the consolidated entity would report their first financial result in q1fy20 according to us the net npa numbers of the merged bank should be about rs 23000 crore which is equal to just one  half years operating profit of the merged bank a very positive number although the integration process may take two years but we believe there would be synergies and it would be a force to reckon with in the near future in ajcons view bob is one of the best psu bank to invest and hold at the current price the author is vicepresident  research at ajcon global services,https://www.moneycontrol.com/news/business/markets/bob-one-of-the-best-psu-banks-to-invest-and-hold-akash-jain-4079961.html,117.95,10-06-2019,121.3,BANKBARODA,12:46,BoB one of the best PSU banks to invest and hold: Akash Jain,moneycontrol
BANK OF BARODA,stateowned bank of baroda has cut mclr on various tenors by up to 10 basis points bps effective on sunday the public sector bank has revised the marginal cost of fundsbased lending rate mclr with effect from july 7 2019 it said in a regulatory filing the benchmark oneyear mclr has been cut by 10 bps to 860 per cent as against 870 per cent earlier the oneyear tenor is the rate around which most of the consumer loans such as home car and personal are set against the one and twomonth mclrs will attract new rate of 830 per cent and 840 per cent respectively down 5 bps each from the earlier rates while for overnight and sixmonth tenor the mclr will be down to 820 per cent and 855 per cent respectively a reduction of 10 bps each earlier last month other psbs such as bank of maharashtra oriental bank of commerce and corporation bank had announced to cut mclr after the rbi had announced its bimonthly monetary policy review,https://www.moneycontrol.com/news/business/bob-cuts-mclr-by-up-to-10-bps-4175801.html,130.45,05-07-2019,129.4,BANKBARODA,18:04,BoB cuts MCLR by up to 10 bps,moneycontrol
BANK OF BARODA,bank nifty has gained 25 percent in the last five months to hit a record high of 3049605 in comparison nifty50 has risen 15 percent in the same period on march 28 bank nifty climbed 13 percent driven by bank of baroda  state bank of india  axis bank  yes bank  rbl bank  pnb  icici bank and indusind bank that rallied between 17 percent the rally in banks is on hope of rate cut in april policy meeting and recapitalisation of psu banks experts said the banking sector has seen a slew of regulations over the past 1012 quarters that are envisaged to bolster the system a few major changes introduced are a insolvency  banking code ibc amendment b asset quality review c implementation of prompt corrective action and d numerous restructuring processes besides these regulatory changes we perceive a few more mediumtolongterm catalysts i perking up industrial activity to spur corporate loans ii aggressive recognition of bad assets and improving recovery to boost asset quality iii softening credit cost to propel return ratios and iv burgeoning share of retail term deposits to provide longterm stability to the source of funds edelweiss said rusmik oza head of fundamental research kotak securities is also positive on the banking sector there is value in most banking stocks within the banking sector our first preference is toward hardcore corporate banks followed by private sector banks he said,https://www.moneycontrol.com/news/business/markets/bank-nifty-jumps-25-in-5-months-propels-nifty-higher-3718101.html,130.1,28-03-2019,121.55,BANKBARODA,16:39,"Bank Nifty jumps 25% in 5 months, propels Nifty higher",moneycontrol
