COMPANYNAME,article,article_link,close,date,prevclose,stockname,time,title,website
TATA STEEL,tata steel posted a consolidated net profit of rs 22952 crore for the quarter ended march 2019 down from rs 14688 crore posted in the same quarter last year consolidated revenue for the quarter grew 259 percent yearonyear yoy to rs 42423 crore in q4fy19 from rs 33705 crore last year higher revenue growth reflects the increase in consolidated steel production and deliveries which rose 27 percent and 29 percent respectively yearonyear also domestic production and deliveries which include the numbers of tata steel standalone and tata steel bsl bhushan steel jumped 46 percent and 55 percent respectively group chief financial officer koushik chatterjee told reporters in a post result conference the consolidated earnings before interest tax depreciation and amortisation ebitda for q4fy19 grew 174 percent yoy to rs 75133 crore however ebitda margin declined to 177 percent from 19 percent in q4 last year standalone domestic ebitda per tonne was at rs 13619 down from rs 14835 last year meanwhile the company also announced the merger of bamnipal steel and tata steel bsl with tata steel managing director and chief executive tv narendran said adding the shareholder of the merging companies will get one share of tata steel for every 15 shares they own production outlook the company expects its production to increase by about 15 million tons next year on a consolidated basis this will include a million tons in the india operations after the acquisition of bhushan steel which has been renamed tata steel bsl the company has three production facilities  in jamshedpur kalinganagar and angul the angul facility comes under tata steel bsl it has a capacity of 5 million tons a year but was doing about 35 million tons when we acquired we have increased the capacity utilisation to 42 million tons and this should increase further said ceo  managing director tv narendran in its european operations the production was impacted by a blast furnace shutdown this added narendran will normalise this financial year and help increase production by up to 07 million tons giving an outlook for the year narendran said that the demand should recover after the general elections get over we expect prices to increase by up to rs 1500 a ton in this quarter he said,https://www.moneycontrol.com/news/business/companies/tata-steel-q4-consolidated-profit-at-rs-2295-crore-ebitda-margin-at-17-7-3892271.html,510.75,25-04-2019,525.25,TATASTEEL,22:21,"Tata Steel Q4 consolidated profit at Rs 2,295 crore, EBITDA margin at 17.7%",moneycontrol
TATA STEEL,german industrial conglomerate thyssenkrupp said friday it expected the european commission to block its plan to merge its european steel business with indian steel giant tata,https://www.moneycontrol.com/news/business/thyssenkrupp-says-expects-eu-to-block-tata-merger-plan-3957841.html,486.8,10-05-2019,519.15,TATASTEEL,15:43,Thyssenkrupp says expects EU to 'block' Tata merger plan,moneycontrol
TATA STEEL,share price of steel major tata steel was down 7 percent intraday on friday after sources told reuters that thyssenkrupp is expecting the joint venture with tata steel to fail thyssenkrupp and tata steel in 2018 unveiled plans to combine their steel activities in germany the netherlands and britain to become the continents secondlargest steelmaker after arcelormittal but the landmark deal has not yet been approved due to concerns about its impact on competition eu antitrust regulators are concerned that the deal would lead to less choice and higher prices for steel and were increasingly likely to block it unless the companies offered greater concessions thyssenkrupp said that it still saw scope for agreement with european antitrust regulators on a planned joint venture with tata steel despite a financial times report that brussels was likely to block the deal a thyssenkrupp spokesman said the competition commission has taken the reworked commitments proposed by thyssenkrupp and tata steel as an opportunity to conduct another market test there are still a number of ways to adjust our commitments without compromising the commercial logic of the joint venture the joint venture announced in june last year is the biggest shakeup in europes steel industry in more than a decade to be named thyssenkrupp tata steel the entity will have around 48000 workers and about 17 billion euros usd 192 billion in sales,https://www.moneycontrol.com/news/business/markets/thyssenkrupp-expects-its-joint-venture-with-tata-steel-to-fail-stock-tanks-7-3957051.html,486.8,10-05-2019,519.15,TATASTEEL,13:33,Thyssenkrupp expects its joint venture with Tata Steel to fail; stock tanks 7%,moneycontrol
TATA STEEL,last week was volatile for indian market the sp bse sensex closed 019 percent lower while the nifty50 closed flat with a positive bias for the week ended april 26 bulls bounced back on dstreet in the final hours of trade which pushed the sp bse sensex above 39000 while nifty50 managed to reclaim 1170011750 levels on a closing basis on april 26 which is a positive sign recovery in the rupee fall in crude oil prices below 72bbl strong rollovers for may series and stable earnings so far are some of the factors that pushed market higher in terms of sectors metals banks oil  gas and energy stocks rose 12 each while profit taking was seen in the auto consumer durable and telecom stocks the march quarter earnings were largely inline with estimates barring few which have not disappointed the street there is value in select names which held for a period of 12 years holds the potential to create wealth for investors suggest experts indian rupee ended near days high at 7001 per dollar on april 26 it gained by 24 paise versus thursday previous close 7025 on the institutional front fiis were net sellers of rs 70 crore while diis were net buyers in indian markets to the tune of rs 920 crore provisional data showed big news  as many as 45 companies will declare their results for the quarter ended march later today which include names like ambuja cements can fin homes gammon india kotak mahindra bank tvs motor company and zensar technologies ambuja cements pat likely to grow by 10 yoy to rs 300 crore kotak mahindra bank pat likely 23 yoy to rs 1388 crore tvs motor company pat likely to fall by 20 yoy to rs 132 crore technical view nifty formed a dragonfly doji kind of pattern on a weekly scale the index closed above 11750 and formed bullish candle on daily charts the index has to clear its immediate hurdle of 11800 for the bullish sentiment to continue three levels 11661 11762 11856 max call oi 12000 12500 max put oi 11000 11500 stocks in news  tata steel s europe unit said on friday a fire broke out at its port talbot site in south wales but there were no major injuries and fire was now under control lt finance holdings said its consolidated net profit more than doubled to rs 55212 crore during the quarter ended march 2019 the company had posted a rs 270 crore net profit in the same period a year ago drug major dr reddys laboratories is recalling 33958 bottles of divalproex sodium extendedrelease tablets used to treat seizure disorders from the american market as per a report by the us health regulator technical recommendations  we spoke to angel broking and heres what they have to recommend mcx india  buy ltp rs 83920 target rs 925 stop loss rs 790 upside 10 grasim industries ltd buy ltp rs 91345 target rs 965 stop loss rs 886 upside 6,https://www.moneycontrol.com/news/business/markets/a-morning-walk-down-dalal-street-nifty-must-breach-11800-for-bullish-sentiment-to-continue-3909651.html,557.2,30-04-2019,545.25,TATASTEEL,07:01,"A morning walk down Dalal Street | Nifty must breach 11,800 for bullish sentiment to continue",moneycontrol
TATA STEEL,tata steel ltds europe unit said on friday a fire broke out at its port talbot site in south wales but there were no major injuries and fire was now under control the port talbot site which dates back to the early 1900s was acquired by tata steel as part of its acquisition of corus in 2007 port talbot is home to one of the two integrated steelmaking sites that the company operates in europe the plant produces hot rolled cold rolled and galvanized coil among other types of steel there was an incident at the port talbot site and there are no major injuries and all persons have been accounted for all fires at the site are now under control said damien brook a spokesman for tata steel europe early this morning a series of blasts were heard from tatas steel plant at the port talbot site in south wales the sun reported,https://www.moneycontrol.com/news/business/tata-steel-europe-unit-fire-under-control-no-major-injuries-3907541.html,,29-04-2019,,TATASTEEL,09:30,"Tata Steel Europe unit fire under control, no major injuries",moneycontrol
TATA STEEL,shares of tata steel ended 66 percent higher on april 26 after company reported its fourth quarter numbers on april 25 the companys consolidated profit fell 76 percent to rs 2431 crore versus rs 10153 crore yoy but on sequential basis qoq it registered 4 percent jump from rs 2334 crore the companys revenue rose to rs 42424 crore from rs 33705 crore yoy the company board approved composite scheme of amalgamation of bamnipal steel and tata steel bsl into and with tata steel the company recommended a dividend of rs 13 per ordinary share of rs 10 each and rs 325 per partly paid ordinary share of rs 10 each to the shareholders of the company for the financial year ended march 31 2019 tata steel share climbed the most in 14 months after the steelmaker beat expectations for quarterly profit clsa has maintained sell call on the stock with a target at rs 395 per share the broking firm expect margin to remain under pressure in fy20 meanwhile its q4 consolidated ebitda up 1 percent qoq but missed estimates by 3 percent the indian ebitdat fell sharply on lower steel prices and an adverse mix the stock is trading at an expensive 63x 20 evebitda it added according to morgan stanly the standalone ebitda miss is reflecting weaker realisation while ebitda miss offset by the strong core performance in europe europe performance drives broadly inline consolidated ebitda also net debt reduced by rs 6200 crore sequentially  this remains a focus the domestic expansion  eu restructuring are on track thyssen jv once executed will lead to debt reduction of 25 billion it feels at close tata steel at rs 545 up rs 3410 or 667 percent on the bse,https://www.moneycontrol.com/news/business/stocks/tata-steel-gains-4-post-q4-nos-clsa-maintains-sell-3895331.html,545.25,26-04-2019,510.75,TATASTEEL,16:05,Tata Steel gains 6% post Q4 nos; CLSA maintains sell,moneycontrol
TATA STEEL,representatives of tata steel s workers unions met chairman n chandrasekaran in mumbai earlier this week seeking assurances on job security in the companys units in europe the visit follows apprehensions about the proposed jv between tata steels european operations and thyssenkrupp favouring the german conglomerate the workers and the union worry that tata steel uks units may be closed down leading to loss of jobs the jv is presently under investigation by the european union commission which is checking if the venture will hurt competition in some of the key segments of the steel sector in europe the two partners have submitted a proposal that includes concessions and the commission is expected to come to a decision by june 17 sources said that representatives of european works council and community were a part of the delegation that met chandrasekaran the unions are unhappy that both tata steel europe and thyssenkrupp presented the remedies to the commission without consulting them all european unions have legal rights to be consulted for anything that impacts the workers said an executive but they had no opportunity to say if the remedies suggested are good or not added the executive another official added it is a concern that is shared by the uk government and the trade unions the jv which was finalised in 2018 will create europes second largest steelmaker after arcelormittal it will have annual revenues of 17 billion euros and will produce 21 million tons of steel a year in a statement earlier this month the works council said the ewc will continue to support the joint venture only if we consider it to be in the best interests of the workforce at all our sites due to these recent developments we are now unconvinced the joint venture is the best option for tata steel europe the commission had identified three industry segments  automotive steel coated steel used for packaging and electrical steel  where the jv may harm competition tata steel and thyssenkrupp are believed to have offered to sell plants in spain belgium and the uk the uk facilities could include units that make electrical steel and packing steel despite the unions reservations tata steel executives say that the company may not have much of a choice but to adhere to what the commission says there is really no question even before other companies have been asked to do the same said a senior executive in 2018 arcelormittal had to sell some of its assets to get the commissions nod for its acquisition of italys ilva thyssenkrupp concerns even as the tata steel management tries to calm the workers nerves its partner is facing challenges of its own as a senior tata steel executive calls it a much more serious challenge on april 24 reuters reported that thyssenkrupps supervisory board plans stresstest the viability of chief executive guido kerkhoffs plans to break up the steeltosubmarines conglomerate given changed market conditions,https://www.moneycontrol.com/news/business/companies/european-unions-meet-tata-steel-chairman-over-concerns-about-jv-with-thyssenkrupp-3895721.html,545.25,26-04-2019,510.75,TATASTEEL,15:29,European unions meet Tata Steel chairman over concerns about JV with thyssenkrupp,moneycontrol
TATA STEEL,the european commission extended the deadline for reviewing the planned joint venture deal between thyssenkrupp and tata steel by 7 working days until june 17 its website showed on friday,https://www.moneycontrol.com/news/business/eu-commission-extends-review-deadline-for-thyssenkrupp-tata-steel-deal-3896641.html,545.25,26-04-2019,510.75,TATASTEEL,13:10,"EU Commission extends review deadline for ThyssenKrupp, Tata Steel deal",moneycontrol
TATA STEEL,at least three blasts were reported at the uks largest tata steelworks plant in port talbot injuring two persons according to a media report the blast at the plant in port talbot wales occurred around 335 am local time bbc reported south wales police department said they are aware of an incident in the tata steelworks plant emergency services are in attendance and further information will be released shortly the department tweeted the police said they received calls at 335 am local time reporting an explosion at the plant at this time we there are just two casualties with minor injuries a tata steel spokesman said the company was working with emergency services and the fires at the plant are under control we can confirm there has been an incident at our port talbot site he said adding that the emergency services have attended and are working with our onsite services the fires has been extinguished and that a full investigation launched into the incident which it said started after a spillage of liquid iron as it was travelling to the steel plant tata steel said in a statement early indications suggested the explosion came from a train used to carry molten metal police was quoted as saying by the report the explosion caused some small fires which are all under control and damage to some buildings on the site the spokesman said,https://www.moneycontrol.com/news/business/3-blasts-at-tata-steelworks-plant-in-uk-3895741.html,545.25,26-04-2019,510.75,TATASTEEL,11:11,3 blasts at Tata Steelworks plant in UK,moneycontrol
TATA STEEL,indias coal import increased by 134 percent to 2072 million tonnes in april compared to 1827 million tonnes mt in the same last year according to a report of the total imports during april 2019 noncoking coal or thermal coal shipments were at 1508 mt according to provisional data by mjunction services imports of coking coal used in iron and steel making were 352 mt in april while metallurgical coke imports during the month were at 022 mt mjunction a joint venture between tata steel and sail  is a b2b ecommerce company that also publishes research reports on coal and steel verticals coal and coke imports during 201819 increased by 966 percent to 23535 mt as compared to 21461 mt imported in fy201718 latest mjunction data showed commenting on the import trend mjunction md and ceo vinaya varma said the flat trend in noncoking coal import in april was in line with expectations as the power plants continued to have sufficient stock of coal this scenario may continue in the current month he added the centre had earlier urged staterun coal india to pledge selfsufficiency in production to eliminate import of thermal coal,https://www.moneycontrol.com/news/business/economy/indias-coal-import-rises-13-to-21-mt-in-april-4021111.html,,26-05-2019,,TATASTEEL,11:35,India's coal import rises 13% to 21 MT in April,moneycontrol
TATA STEEL,there is unease at the uk units of tata steel with unions demanding assurance that the operations will not be split and sold off after the proposed joint venture with thyssenkrupp collapsed last week the unions had been unhappy about the remedies proposed by tata steel to get a nod from the european commission for the jv but the commission which was probing if the jv would hurt competition blocked the deal the tatas offered three units totaling nearly a million tons of annual capacity and thyssenkrupp offered only one small unit tatas european unions felt it was no longer a jv but a takeover a senior londonbased official told moneycontrol if thyssenkrupp had put forward a remedy then the jv would have been accepted by the commission its disappointing and frustrating from unions view but we did not agree with the remedies they put forward the official added though the joint venture is no longer on the horizon the workers now fear tata steel will look for options to sell the units and that will lead to job losses they want assurances that the european operations are not broken up and units are not sold off individually said another executive the tatas now have to commit to the investment programme for europe and with the right leadership the european businesses will be successful said the first official quoted above tata steels european operations include units in the uk and netherlands and employ about 20000 people the netherlandsbased unit are said to among the most profitable ones in europe but the uk operations have been constrained under high energy costs in the country and legacy issues tata steel didnt respond to queries from moneycontrol looking at options addressing the media on a conference call on may 10 after the jv was called off tata steel ceo  md tv narendran reiterated that the company has a few options and is exploring them he also added that the uk operations should improve upon their performance this year after a blast furnace shutdown dented numbers in 2018 at the same time he underlined that the units in europe need to be cash positive while executive director  cfo koushik chatterjee said that the volumes in europe should increase by 5 percent this year the demand outlook in the continent is dim the management was hoping to bring some stability to the units under the jv which would have also taken over about 15 percent of tata steel debt of nearly rs 1 lakh crore but the circumstances have now turned the union leaders may again seek an appointment with tata steel chairman n chandrasekaran whom they had met in april,https://www.moneycontrol.com/news/business/companies/unease-among-uk-unions-as-tata-steel-looks-for-options-after-collapse-of-jv-with-thyssenkrupp-3969471.html,469.55,14-05-2019,472.3,TATASTEEL,15:55,Unease among UK unions as Tata Steel looks for options after collapse of JV with thyssenkrupp,moneycontrol
TATA STEEL,the collapse of tata steel s proposed joint venture with german conglomerate thyssenkrupp is marginally credit negative for the indian steel major a global rating agency has said the steel majors indian operation will largely be able to offset the impact of the collapse it said tata steel ltd and thyssenkrupp ags decision to cease efforts on their proposed europe joint venture is marginally credit negative for tata steel sp rating said in a bulletin in the wake of the development this is likely to depress the ratio of funds from operations ffo to debt by about 100 basis points across our forecast horizon it said tata steel and the german conglomerate decided to call off their proposed steel joint venture jv expecting the deal to be rejected by the european commission over continuing concerns the cancellation of the joint venture will also leave tata steel exposed to the weaker and more volatile performance of the european operations until the company identifies an alternative strategy to deconsolidate the european operations the global rating agency said however sustained high steel prices and continued robust profitability of tata steels india business remain the more important factors for our positive rating outlook on the company bbpositive it said we expect supportive steel prices and continued high utilisation in the india business to drive tata steels ffotodebt sustainably above 15 per cent over the next six to 12 months this is notwithstanding the drag from the retention of the europe business and the lowerthanexpected fourth quarter profitability in 2019 sp said the breakup of the proposed jv may also restrict the steel major to go for further acquisition in india any outsized spending by tata steel on new acquisitions would be a risk to our estimates though we view this risk to be lowgiven that there are no large steel mills left to be auctioned in indian bankruptcy courts the bulletin said,https://www.moneycontrol.com/news/business/jv-breakup-with-thyssenkrupp-marginally-credit-negative-for-tata-steel-sp-3970781.html,469.55,14-05-2019,472.3,TATASTEEL,12:59,JV breakup with Thyssenkrupp marginally credit negative for Tata Steel: S&P,moneycontrol
