COMPANYNAME,article,article_link,close,date,prevclose,stockname,time,title,website
TATA STEEL,mumbai is planning to tap the foreign loan market to raise 2 billion its largest such borrowing till date as group companies including and are expected to need liquidity support from the conglomerates holding company senior tata leaders are currently engaged with bankers and other financial institutions for price discovery ahead of the scheduled fundraise multiple officials aware of the situation said the plan is to build a book at 120 basis points above libor and the facility is expected to be for five years in early 2018 tata sons raised 750 million through a special reserve bank of india dispensation to repay lenders of tata teleservices but following the changes in guidelines earlier this year which allowed nbfcs to tap the foreign loan market tata sons registered as a core investment company with the rbi is once again keen to avail this option the rbi approval is awaited a tata sons spokesperson declined to comment tata sons is the principal investment holding company of the tata group around 66 of tata sons share capital is held by public charitable trusts it also holds equity stakes in major group companies including flagship tata consultancy services ltd tata steel ltd tata motors ltd tata power company ltd tata chemicals ltd tata investment corporation ltd ttsl tata capital ltd tata sky ltd tata projects ltd among others bulking up its balance sheet now is key as two of the groups biggest businesses are facing severe headwinds globally net debt at tata motors stands at rs 28000 crore of which rs 6500 crore is jlrs as per the groups own estimate as jaguar land rover still struggles to tide over a demand slump in china the worlds biggest auto market similarly a steel deal in europe that wouldve eased the groups liabilities unravelled this month after regulators blocked a merger proposal with germanys thyssenkrupp to create europes second largest steelmaker the combined gross debt of steel and auto stands at 27 billion as per bloomberg estimates constituting a lions share of about 40 billion group debt  the largest for any indian conglomerate this excludes debt of 9 billion till march 2018 for tata steel bsl ltd and tata teleservices maharashtra ltd which are in the process of restructuring the twin developments mark the biggest challenge facing the 151yearold group that ventured overseas through a series of headline grabbing acquisitions more than a decade ago however bankers believe the flexibility of an aggressive pricing might not be easy at this moment especially after the muted response to some of the groups debt papers in december jlrs singapore based holding company raised 1 billion for five years from a consortium of nine banks including hsbc standard chartered bank mizuho citi credit agricole among others these banks subsequently found it extremely difficult to sell down during syndication and trades took place at a steep discount the tata group has been diversifying its business presence through both organic and inorganic means this has resulted in large funding requirements across group companies tata sons with its strong balance sheet and liquidity and being the principal investment holding company of the tata group is expected to participate in investments in these group companies said subodh rai senior director at crisil as a result tata sons business risk profile will depend on the success of these investments tata sons debt to market value of investments ratio has increased due to increased level of investments in the group entities including  the ratio of debt to market value of investments may increase to over 10 in the medium term in the past tata sons has subscribed to rights issues by group companies it has also hiked its stake in tata motors to consolidate promoter holding and soothe investor nerves last march tata sons sold a marginal 15 stake in tcs for rs 9000 crore primarily to improve the leverage ratio of the holding company which has been purchasing stakes from group companies as part of untangling the crossholdings among them steel has come as a bolt from the blue tata sons has to also bankroll group initiatives like financial services aviation retail  all cash guzzlers thyssenkrupp was to maximise cost and operational synergies and an alternative could also run into the same regulatory challenges expect some serious reviews of business and divestments said an old group watcher on condition of anonymity tata sons financial flexibility comes from its ability to raise additional funds by sale or pledge of its large portfolio of investments mainly equity shares in tcs as on july 30 2018 the market value of investments was about rs 65 lakh crore of which tcs constituted more than 80 in value according to crisil tata sons financial risk profile is supported by companys comfortable liquidity and a sound capital structure tata sons remains adequately resourced which together with regular dividend income  primarily from its holding in tcs  provides high cash flow adequacy for debt servicing which reflects a strong financial profile as on july 31 2018 tata sons standalone cash and cash equivalents were about rs 5587 crore tata sons will continue to manage its liabilities and cash prudently investments proposed to be made in fy19 are expected to be funded through a combination of share buyback programme of tcs dividend flow from the group companies as well as divestments by tata sons,https://economictimes.indiatimes.com/markets/stocks/news/tata-sons-plans-to-borrow-2-billion-from-overseas-market/articleshow/69453549.cms,464.7,23-05-2019,473.0,TATASTEEL,06:40,Tata Sons plans to borrow $2 billion from overseas market,economictimes
TATA STEEL,new delhi metal shares were trading in the green in mondays morning session shares of up 523 per cent up 363 per cent tata steel up 316 per cent and jindal stainless hisar up 289 per cent were trading higher in the metal pack national aluminium company up 262 per cent steel authority of india sail up 203 per cent jindal steel  power up 109 per cent and hindalco industries up 107 per cent too were trading with gains the nifty metal index was trading 104 per cent up at 293460 around 1044 am benchmark nse nifty50 index was up 4055 points at 1188465 while the bse sensex was up 15538 points at 3959010 among the 50 stocks in the nifty index 30 were trading in the green while 19 were in the red shares of yes bank vodafone idea ashok leyland ncc bank of baroda dish tv india rail vikas nigam pnb sbi and pc jeweller were among the most traded shares on the nse,https://economictimes.indiatimes.com/markets/stocks/news/share-market-update-metal-shares-up-tata-steel-gains-over-3nbspbr/articleshow/69513232.cms,512.55,27-05-2019,484.15,TATASTEEL,10:50,Share market update: Metal shares up; Tata Steel gains over 3% ,economictimes
TATA STEEL,new delhi technical analysts are optimistic on dalal street they expect nifty50 to touch the 12000 mark on a closing basis sooner than later with the positive momentum broadening to secondrung stocks technical charts are signalling broader participation and nearly 120 stocks on nse now look set for a strong rally as suggested by moving average convergence divergence or macd the momentum indicator signalled an bullish crossover  a sign of bullish undertone  on these counters hinting at possible upsides these stocks have been witnessing strong trading volumes of late lending credence to the emerging trend the list included shares of steelmakers like sail  jsw steel and jspl and banks such as  union bank idfc first bank and bank of maharashtra among others  hdfc life interglobe aviation future enterprises and torrent power are a few other names on the list the macd is known for signalling trend reversals in traded securities or indices it is the difference between the 26day and 12day exponential moving averages a nineday exponential moving average called the signal line is plotted on top of the macd to reflect buy or sell opportunities when the macd crosses above the signal line it gives a bullish signal indicating that the price of the security may see an upward movement and vice versa data showed seven stocks are showing bearish trends they included manpasand beverages page industries lt infotech blis gvs pharma and bajaj consumer care the macd indicator should not be seen in isolation as it may not be sufficient to take a trading call just the way a fundamental analyst cannot give a buy or sell recommendation using a single valuation ratio traders should make use of other indicators such as relative strength index rsi bollinger bands fibonacci series candlestick patterns and stochastic to confirm an emerging trend as far as nifty50 is concerned daily strength indicator rsi is moving upward and above its reference line signalling a positive bias besides the formation of higher top and bottom on the daily charts indicate that nifty supports are shifting higher if the 50pack crosses and sustains above 11970 level it would witness buying which can lift the index towards the 1200012050 range however if the index breaks below 11900 it would head towards the 1185011820 range a close look at the stock chart of sail shows whenever the macd line has breached above the signal line the stock has shown an upward momentum and vice versa on tuesday the stock traded 04 per cent down at rs 5340 on bse,https://economictimes.indiatimes.com/markets/stocks/news/sail-tata-steel-jspl-south-indian-bank-idfc-first-among-120-stocks-readying-to-rally-shows-macd/articleshow/69531909.cms,507.05,28-05-2019,512.55,TATASTEEL,11:39,"SAIL, Tata Steel, JSPL, South Indian Bank, IDFC First among 120 stocks readying to rally, shows MACD",economictimes
TATA STEEL,new delhi metal shares were trading in the red in thursdays morning session shares of welspun corp down 130 per cent down 069 per cent apl apollo tubes down 055 per cent and jindal steel  power down 031 per cent were the top losers in the index national aluminium company down 030 per cent steel authority of india sail down 029 per cent hindalco industries down 015 per cent and vedanta down 006 per cent too were trading lower the nifty metal index was trading 004 per cent down at 293625 around 1043 am benchmark nse nifty50 index was up 5410 points at 1191520 while the bse sensex was up 21559 points at 3971764 among the 50 stocks in the nifty index 34 were trading in the green while 16 were in the red shares of vodafone idea pc jeweller yes bank adani power pnb bel gmr infra rail vikas nigam sbi and powergrid were among the most traded shares on the nse,https://economictimes.indiatimes.com/markets/stocks/news/share-market-update-metal-shares-decline-welspun-corp-down-1nbspbr/articleshow/69572456.cms,487.95,30-05-2019,493.3,TATASTEEL,10:48,Share market update: Metal shares decline; Welspun Corp down 1% ,economictimes
TATA STEEL,new delhi most metal shares were trading with gains in mondays morning session shares of tata steel up 191 per cent up 128 per cent up 103 per cent and apl apollo tubes up 088 per cent were trading with gains jindal stainless hisar up 078 per cent welspun corp up 072 per cent jsw steel up 071 per cent and hindalco industries up 054 per cent too were trading in the green the nifty metal index was trading 070 per cent up at 292730 around 1043 am benchmark nse nifty50 index was up 6830 points at 1193895 while the bse sensex was up 24373 points at 3985963 among the 50 stocks in the nifty index 39 were trading in the green while 11 were in the red shares of yes bank vodafone idea bank of baroda pnb dish tv india sbi sail jk bank tata motors and motherson sumi were among the most traded shares on the nse,https://economictimes.indiatimes.com/markets/stocks/news/share-market-update-metal-shares-trade-higher-tata-steel-up-2nbspnbspbr/articleshow/69720734.cms,486.05,10-06-2019,482.1,TATASTEEL,10:49,Share market update: Metal shares trade higher; Tata Steel up 2%  ,economictimes
TATA STEEL,new delhi most metal shares were trading with gains in tuesdays morning session shares of vedanta up 260 per cent jindal steel  power up 144 per cent steel authority of india   up 124 per cent and national aluminium company up 112 per cent were the top performers in the index up 081 per cent jsw steel up 075 per cent nmdc up 072 per cent and welspun corp up 032 per cent too were trading with gains the nifty metal index was trading 084 per cent up at 293680 around 1044 am benchmark nse nifty50 index was up 1475 points at 1193745 while the bse sensex was up 6865 points at 3985317 among the 50 stocks in the nifty index 30 were trading in the green while 20 were in the red shares of yes bank vodafone idea indiabulls housing finance pnb dish tv india tata motors bank of baroda sterlite tech gmr infra and sun pharma were among the most traded shares on the nse,https://economictimes.indiatimes.com/markets/stocks/news/share-market-update-metal-shares-advance-vedanta-rises-over-2nbspbr/articleshow/69735330.cms,492.5,11-06-2019,486.05,TATASTEEL,10:50,Share market update: Metal shares advance; Vedanta rises over 2% ,economictimes
TATA STEEL,new delhi equity benchmarks and were trading lower in wednesdays session on account of selling in frontline bluechip counters etmarketscom collated a list of trading ideas from various experts and heres what they had recommended for todays afternoon trade is a buy call with a target price of rs 1600 and a stop loss of rs 1360 hdfc life is a buy call with a target price of rs 520 and a stop loss of rs 420 is a buy call with a target price of rs 390 and a stop loss of rs 300 is a buy call with a target price of rs 520 and a stop loss of rs 495 eil is a buy call with a target price of rs 128 and a stop loss of rs 116,https://economictimes.indiatimes.com/markets/stocks/news/top-intraday-trading-ideas-for-afternoon-trade-for-wednesday-12-june-2019/articleshow/69751658.cms,505.85,12-06-2019,492.5,TATASTEEL,11:32,Top intraday trading ideas for afternoon trade for Wednesday 12 June 2019,economictimes
TATA STEEL,new delhi most metal shares were trading on a mixed note in fridays morning session shares of nmdc up 217 per cent up 068 per cent up 065 per cent and national aluminium company up 041 per cent were the top gainers in the index jindal steel  power down 086 per cent apl apollo tubes down 081 per cent hindustan copper down 073 per cent and moil down 044 per cent were trading in the red the nifty metal index was trading 026 per cent up at 296375 around 1045 am benchmark nse nifty50 index was down 48 points at 1186605 while the bse sensex was down 13739 points at 3960397 among the 50 stocks in the nifty index 13 were trading in the green while 37 were in the red shares of yes bank gruh finance indiabulls housing finance bhel pnb sail bank of baroda dish tv india idbi bank and dlf were among the most traded shares on the nse,https://economictimes.indiatimes.com/markets/stocks/news/share-market-update-metal-shares-mixed-nmdc-gains-over-2nbspbr/articleshow/69783183.cms,501.8,14-06-2019,502.55,TATASTEEL,10:51,Share market update: Metal shares mixed; NMDC gains over 2% ,economictimes
TATA STEEL,new delhi most metal shares were in the negative zone in mondays morning session shares of steel authority of india sail down 278 per cent  down 262 per cent  jindal steel  power down 261 per cent and down 230 per cent were the worst performers in the index vedanta down 206 per cent  jindal stainless hisar down 164 per cent  apl apollo tubes down 154 per cent and moil down 124 per cent too were trading lower the nifty metal index was trading 161 per cent down at 289735 around 1030 am benchmark nse nifty50 index was down 7610 points at 1174720 while the bse sensex was down 22930 points at 3922277 shares of yes bank vodafone idea ashok leyland sail pnb bhel adani power tata motors and indiabulls housing finance were among the most traded securities on the nse,https://economictimes.indiatimes.com/markets/stocks/news/share-market-update-metal-shares-decline-sail-slips-nearly-3nbspbr/articleshow/69820428.cms,473.1,17-06-2019,501.8,TATASTEEL,10:36,Share market update: Metal shares decline; SAIL slips nearly 3% ,economictimes
TATA STEEL,new delhi most metal shares were trading with gains in wednesdays morning session shares of jindal steel  power up 416 per cent steel authority of india   up 292 per cent up 264 per cent and vedanta up 171 per cent were the top gainers in the index welspun corp up 118 per cent national aluminium company up 100 per cent hindalco industries up 100 per cent and jindal stainless hisar up 086 per cent too were trading higher the nifty metal index was trading 108 per cent up at 298250 around 1051 am benchmark nse nifty50 index was down 7045 points at 1189515 while the bse sensex was down 24567 points at 3970479 among the 50 stocks in the nifty index 15 were trading in the green while 35 were in the red shares of yes bank indiabulls housing finance sail dish tv india pnb jspl bank of baroda vodafone idea motherson sumi and tata steel were among the most traded shares on the nse,https://economictimes.indiatimes.com/markets/stocks/news/share-market-update-metal-shares-advance-jspl-jumps-over-4nbspbr/articleshow/69751126.cms,505.85,12-06-2019,492.5,TATASTEEL,10:56,Share market update: Metal shares advance; JSPL jumps over 4% ,economictimes
TATA STEEL,nifty50 failed to surpass the immediate barrier in the 1197512000 zone and witnessed selling pressure towards 11866 level it negated the formation of higher highs and lows after three sessions but followup profit booking was also missing at lower levels the index formed a bearish candle on the daily scale followed by multiple doji candles which indicated a tug of war in the 1176112000 zone now as long as it holds below 12000 level nifty could extend its weakness towards the lower band of the support at 11761 level and then see a fresh decline towards 11660 level while on the upside immediate hurdles are seen at 11965 and then 12000 levels on the options front maximum put open interest was at 11500 followed by 11800 levels while maximum call oi was at 12500 followed by 12000 level put writing was seen at 11500 followed by 12000 levels while there was call writing at 12000 followed by 12100 levels the option data suggested a wider trading range between 11750 and 12100 levels india vix fell 254 per cent to 1412 level volatility hovered below the 16 mark which supported buying interest on declines but at the same time ruled out any major swing in the market bank nifty opened in the negative and headed towards the 30900 level it formed a bearish candle on daily scale and negated the formation of higher highs and lows after three sessions as long as it holds below 31313 level the index could extend its weakness towards 30600 level while on the upside hurdles are seen at 31313 and then 31500 levels nifty futures closed in the negative at 11925 with a loss of 043 per cent long buildup was seen in torrent pharma  and while shorts were seen in biocon indiabulls housing finance beml and ceat,https://economictimes.indiatimes.com/markets/stocks/news/fo-india-vix-rules-out-major-swings-supports-buying-on-dips/articleshow/69756515.cms,505.85,12-06-2019,492.5,TATASTEEL,16:38,"F&O: India Vix rules out major  swings, supports buying on dips",economictimes
TATA STEEL,mumbai  a subsidiary of  is planning to raise up to rs 1800 crore through a rights issue to primarily retire existing debt early said two people familiar with the matter the company had raised debt to help fund its acquisition of the steel business of debtridden uml the board will meet on thursday to consider the terms of the right issue including the rights entitlement ratio total number of shares to be issued issue price and record date it has already obtained approval from stock exchanges for the proposed rights issue tata sponge iron is expected to price the rights issue at about 2025 discount to the current market price one of the persons cited above told et axis capital sbi cap centrum capital are helping the company to run the issuance individual arrangers could not be contacted immediately for comments an email sent to the company did not elicit any response until the publication of this report shares of tata sponge which declined 8 so far this year ended flat at rs 71025 on wednesday so far in the current financial year five companies have raised a record rs 51000 crore through rights issues two telecom operators airtel and ideavodafone have successfully raised rs 25000 crore each last month tata sponge in april completed the acquisition of usha martins steel business undertaking including its captive power plants the deal was completed pursuant to a cash consideration of rs 4094 crore payable to uml after adjustment for negative working capital and debt like items tata sponge is tata steels chosen vehicle for the acquisition of umls steel division tata steel had entered into an agreement for acquiring the uml steel division in september 2018 tata sponge which operates at about 115 percent of capacity is striving to boost volumes the company reported a 43 onyear increase in sales in the march 19 quarter but sequentially sales dropped 265 reflecting the correction in sponge iron prices,https://economictimes.indiatimes.com/markets/stocks/news/tata-sponge-to-raise-rs-1800-cr-via-rights-issue/articleshow/69761487.cms,505.85,12-06-2019,492.5,TATASTEEL,21:55,"Tata Sponge to raise Rs 1,800 cr via rights issue",economictimes
TATA STEEL,new delhi domestic equity market is likely to open lower on thursday tracking futures on the singapore stock exchange sgx niftyand mixed asian cues at 828 am the sgx nifty was 2750 points or 023 per cent lower at 11898 et now spoke to various experts and heres what they have to recommend for todays trade is a buy call with a target price of rs 525 and a stop loss of rs 494 is a sell call with a target price of rs 6700 and a stop loss of rs 6920 is a buy call with a target price of rs 422 and a stop loss of rs 404 amara raja batteries is a sell call with a target price of rs 604 and a stop loss of rs 640 united spirits is a buy call with a target price of rs 592 and a stop loss of rs 569 tcs is a buy call with a target price of rs 2330 and a stop loss of rs 2235,https://economictimes.indiatimes.com/markets/stocks/news/buy-or-sell-ideas-from-experts-for-thursday-13-june-2019/articleshow/69765418.cms,502.55,13-06-2019,505.85,TATASTEEL,08:33,'BUY' or 'SELL' ideas from experts for Thursday 13 June 2019,economictimes
TATA STEEL,new delhi shares of tata steel jumped 4 per cent in the wednesdays session and broke their losing streak of the last four consecutive sessions the stock opened at rs 48020 on bse and touched intraday high and low at rs 498 and rs 48020 in wednesdays trade global financial firm has maintained a buy recommendation on the stock with a target price of rs 570 per share even as steel spreads are weakening on global growth concerns goldman highlighted that the domestic demand for steel is resilient but spreads are unlikely to bounce back last monday in an interview with etnow  ceo  md of tata steel said that the trade war impacts the company in europe but it does not impact it much in india tata steels proposed jv with thyssenkrupp has been called off and narendran said the firm is focussing on efficiency and operational improvements we are focussed on the operational improvement that was anyway happening and we will continue to do that just now the focus is going to be more from the efficiency angle we will continue to drive that both in india and overseas it will come from further improvement in performance in  integration of usha martin and other efficiencies that we will drive both in europe and in india he said shares of tata steel closed 460 per cent up at rs 49450 on bse,https://economictimes.indiatimes.com/markets/stocks/news/tata-steel-jumps-4-on-course-to-break-4-day-losing-streak/articleshow/69852372.cms,494.1,19-06-2019,472.3,TATASTEEL,15:44,"Tata Steel jumps 4%, breaks 4-day losing streak",economictimes
BANK OF BARODA,new delhi shares of psu banks were trading in the negative zone in fridays morning session shares of allahabad bank down 126 per cent down 075 per cent down 063 per cent and union bank of india down 057 per cent were trading in the red bank of india down 046 per cent oriental bank of commerce down 039 per cent canara bank down 023 per cent and state bank of india down 023 per cent too were trading with losses the nifty psu bank index was trading 029 per cent down at 316185 around 1100 am benchmark nse nifty50 index was down 8 points at 1157490 while the bse sensex was down 1675 points at 3880636 among the 50 stocks in the nifty index 24 were trading in the green while 26 were in the red shares of pfc dish tv india yes bank adani power pnb vodafone idea sail jspl ashok leyland and tata motors were among the most traded shares on the nse,https://economictimes.indiatimes.com/markets/stocks/news/share-market-update-psu-bank-shares-slip-allahabad-bank-down-1nbspbr/articleshow/70187261.cms,125.95,12-07-2019,126.0,BANKBARODA,11:06,Share market update: PSU Bank shares slip; Allahabad Bank down 1% ,economictimes
